{
  "$schema": "../schemas/case-catalog.schema.json",
  "cases": [
    {
      "category": "CORE",
      "deviceRoles": [],
      "executionTarget": "buildHost",
      "expected": "The production Swift oracle and Rust core produce byte-identical logical paths, Markdown bytes, and hashes for every governed new-note text/link fixture, including the production final-newline consumer path.",
      "id": "CORE-001",
      "invariants": [
        "INV-BOUND-CONTENT",
        "INV-PRIVACY-DIAGNOSTICS"
      ],
      "milestone": "M2",
      "providerApplicability": "none",
      "required": true,
      "title": "M2 exact Swift and Rust parity"
    },
    {
      "category": "CORE",
      "deviceRoles": [],
      "executionTarget": "buildHost",
      "expected": "Unsupported contract, profile, operation, version, or hash inputs fail with the specified typed incompatibility and produce no admissible plan or native side effect.",
      "id": "CORE-002",
      "invariants": [
        "INV-BOUND-CONTENT",
        "INV-PRIVACY-DIAGNOSTICS"
      ],
      "milestone": "M2",
      "providerApplicability": "none",
      "required": true,
      "title": "M2 unsupported versions fail closed"
    },
    {
      "category": "CORE",
      "deviceRoles": [],
      "executionTarget": "artifactBuildHost",
      "expected": "Regenerating committed Swift and Kotlin UniFFI bindings from the pinned source and generator produces a zero-byte diff.",
      "id": "CORE-003",
      "invariants": [
        "INV-PRIVACY-DIAGNOSTICS"
      ],
      "milestone": "M2",
      "providerApplicability": "none",
      "required": true,
      "title": "M2 generated binding drift"
    },
    {
      "category": "CORE",
      "deviceRoles": [],
      "executionTarget": "buildHost",
      "expected": "Readiness reports every independently versioned contract/profile/hash pin, and every mismatch makes the complete operation incompatible before materialization.",
      "id": "CORE-004",
      "invariants": [
        "INV-BOUND-CONTENT",
        "INV-PRIVACY-DIAGNOSTICS"
      ],
      "milestone": "M2",
      "providerApplicability": "none",
      "required": true,
      "title": "M2 readiness pin completeness"
    },
    {
      "category": "CORE",
      "deviceRoles": [],
      "executionTarget": "buildHost",
      "expected": "Apple shadow mode returns legacy authority and performs no write, attachment copy, quota reservation, queue mutation, success reporting, or content/path logging while comparing the same frozen input.",
      "id": "CORE-005",
      "invariants": [
        "INV-PRIVACY-DIAGNOSTICS",
        "INV-SHADOW-NO-SIDE-EFFECTS"
      ],
      "milestone": "M2",
      "providerApplicability": "none",
      "required": true,
      "title": "M2 Apple shadow side-effect isolation"
    },
    {
      "category": "CORE",
      "deviceRoles": [],
      "executionTarget": "artifactBuildHost",
      "expected": "The committed generated Kotlin binding is consumed by the handwritten Android bridge, all four native ABIs load lazily, exact readiness pins are supplied independently, incompatibility fails closed, and no Kotlin renderer fallback can produce a plan.",
      "id": "CORE-006",
      "invariants": [
        "INV-BOUND-CONTENT",
        "INV-PRIVACY-DIAGNOSTICS"
      ],
      "milestone": "M3",
      "providerApplicability": "none",
      "required": true,
      "title": "M3 Kotlin bridge and Rust authority"
    },
    {
      "category": "CORE",
      "deviceRoles": [],
      "executionTarget": "artifactBuildHost",
      "expected": "Android manifest, legacy backup rules, and data-extraction rules exclude every capture package, prepared byte, database, journal, receipt, provider grant, identity, quota record, model, diagnostic, and preference by default; no broad storage or media permission is present.",
      "id": "CORE-007",
      "invariants": [
        "INV-LAST-DURABLE-COPY",
        "INV-PRIVACY-DIAGNOSTICS"
      ],
      "milestone": "M3",
      "providerApplicability": "none",
      "required": true,
      "title": "M3 backup and manifest exclusion"
    },
    {
      "category": "CORE",
      "deviceRoles": [],
      "executionTarget": "buildHost",
      "expected": "Quota reservation precedes commit, failed/retry/permission/unknown outcomes do not charge, verified success commits once by request ID, and replay or process restart cannot double-charge.",
      "id": "CORE-008",
      "invariants": [
        "INV-LAST-DURABLE-COPY"
      ],
      "milestone": "M3",
      "providerApplicability": "none",
      "required": true,
      "title": "M3 exact-once successful-delivery quota"
    },
    {
      "category": "CORE",
      "deviceRoles": [],
      "executionTarget": "buildHost",
      "expected": "The composer retains the draft and does not report Saved locally or clear until request bytes are fsynced, the package is durably promoted, and its Room index row is committed; every injected earlier failure preserves editable content.",
      "id": "CORE-009",
      "invariants": [
        "INV-LAST-DURABLE-COPY"
      ],
      "milestone": "M3",
      "providerApplicability": "none",
      "required": true,
      "title": "M3 composer durable acknowledgement"
    },
    {
      "category": "CORE",
      "deviceRoles": [
        "phone-current-pixel",
        "phone-current-samsung"
      ],
      "executionTarget": "physicalDevice",
      "expected": "Seed capture packages, journals, Room indexes, quota records, installation identity, and provider-grant state; extracted backup and device-transfer artifacts exclude all authority and content, fresh-install and device-transfer targets create a new installation identity, restore neither quota nor grants nor content, and enter explicit vault grant repair, while the original installation's seeded local package remains unchanged.",
      "id": "CORE-010",
      "invariants": [
        "INV-LAST-DURABLE-COPY",
        "INV-PRIVACY-DIAGNOSTICS"
      ],
      "milestone": "M3",
      "providerApplicability": "none",
      "required": true,
      "title": "M3 physical backup extraction and reinstall identity repair"
    },
    {
      "category": "CORE",
      "deviceRoles": [],
      "executionTarget": "buildHost",
      "expected": "A named typed ADR-0018 recovery producer executes corrupt package, truncated package, stale lease, orphan quota reservation, and package/row divergence in both directions plus package/journal divergence; package plus journal remains recovery authority, Room is rebuilt or quarantined without inventing success, and reservations are reconciled without double charge.",
      "id": "CORE-011",
      "invariants": [
        "INV-LAST-DURABLE-COPY",
        "INV-PRIVACY-DIAGNOSTICS"
      ],
      "milestone": "M3",
      "providerApplicability": "none",
      "required": true,
      "title": "M3 ADR-0018 package journal reconciliation matrix"
    },
    {
      "category": "REC",
      "deviceRoles": [
        "phone-low-api28",
        "phone-current-pixel",
        "phone-current-samsung"
      ],
      "executionTarget": "physicalDevice",
      "expected": "After abrupt process kill and explicit relaunch, the durable prefix is recoverable with no more than two seconds lost.",
      "id": "REC-001",
      "invariants": [
        "INV-LAST-DURABLE-COPY"
      ],
      "milestone": "M4",
      "providerApplicability": "none",
      "required": true,
      "title": "Abrupt process kill preserves recorder prefix"
    },
    {
      "category": "REC",
      "deviceRoles": [
        "phone-low-api28",
        "phone-current-pixel",
        "phone-current-samsung"
      ],
      "executionTarget": "physicalDevice",
      "expected": "Explicit relaunch offers finalize, recover, or discard for the last durable prefix; continuous recording is not claimed.",
      "id": "REC-002",
      "invariants": [
        "INV-LAST-DURABLE-COPY"
      ],
      "milestone": "M4",
      "providerApplicability": "none",
      "required": true,
      "title": "Force-stop and reboot recovery"
    },
    {
      "category": "REC",
      "deviceRoles": [
        "phone-current-pixel",
        "phone-current-samsung"
      ],
      "executionTarget": "physicalDevice",
      "expected": "Call interruption, device mic toggle, permission revocation, and zero input become distinct actionable durable states without deleting audio.",
      "id": "REC-003",
      "invariants": [
        "INV-LAST-DURABLE-COPY"
      ],
      "milestone": "M4",
      "providerApplicability": "none",
      "required": true,
      "title": "Interruption, mic revoke, and zero-input handling"
    },
    {
      "category": "SAF",
      "deviceRoles": [
        "phone-current-pixel",
        "phone-current-samsung"
      ],
      "executionTarget": "physicalDevice",
      "expected": "The Rust-authoritative new-note text/link bytes commit once and the note is read back with exact length and SHA-256 verification.",
      "id": "SAF-001",
      "invariants": [
        "INV-LAST-DURABLE-COPY",
        "INV-BOUND-CONTENT"
      ],
      "milestone": "M3",
      "providerApplicability": "allRequired",
      "required": true,
      "title": "Create new text/link note with exact verification"
    },
    {
      "category": "SAF",
      "deviceRoles": [
        "phone-current-pixel",
        "phone-current-samsung"
      ],
      "executionTarget": "physicalDevice",
      "expected": "Revoked permission enters needsPermission and the staged package remains recoverable through re-selection.",
      "id": "SAF-002",
      "invariants": [
        "INV-LAST-DURABLE-COPY"
      ],
      "milestone": "M3",
      "providerApplicability": "allRequired",
      "required": true,
      "title": "Revoked grant preserves queue"
    },
    {
      "category": "SAF",
      "deviceRoles": [
        "phone-current-pixel",
        "phone-current-samsung"
      ],
      "executionTarget": "physicalDevice",